{
  "patch_id": "PATCH_EP001_S04_SH003_001",
  "shot_id": "EP001_S04_SH003",
  "from_version": "V01",
  "to_version": "V02",
  "fix_reason": "COSTUME",
  "keep": [
    "face_identity",
    "body",
    "camera",
    "composition",
    "lighting",
    "actor_position"
  ],
  "change": [
    "collar shape",
    "belt",
    "sleeve ornamentation"
  ],
  "reason": "collar and belt not consistent with COSTUME_SILLA_OFFICIAL_A01",
  "requested_by": "사용자",
  "created_at": "2026-09-11",
  "resulting_prompt_id": null,
  "resulting_generation_id": null
}
