{
  "patch_id": "PATCH_MP_ATTENDANT_FULL_BODY_002",
  "shot_id": "MASTER_PACK:CHAR_SILLA_ATTENDANT_GROUP_01:full_body",
  "from_version": "V03",
  "to_version": "V04",
  "fix_reason": "HISTORICAL_ISSUE",
  "keep": [
    "three faces and bodies",
    "poses",
    "hair and headwear",
    "trousers and skirt",
    "fabric colours",
    "bundles",
    "woman's corrected jacket",
    "background",
    "lighting"
  ],
  "change": [
    "remove remaining chest ribbon ties on the two men",
    "add plain cloth waist belt to the middle man"
  ],
  "reason": "V03 edit (GEN_MP_ATTENDANT_FULL_BODY_HIGGSFIELD_V02) PARTIAL: only the woman's ties were removed. Retry targets the two men by position, input = the partial edit.",
  "requested_by": "사용자 (D-021, 2026-09-13)",
  "created_at": "2026-09-13",
  "resulting_prompt_id": "PRM_MP_CHAR_SILLA_ATTENDANT_GROUP_01_FULL_BODY_V04",
  "resulting_generation_id": null
}
